{
  "receiptId": "exampleco-stale-receipt-2026-03-24",
  "issuedAt": "2026-03-24T05:25:00Z",
  "bundleId": "exampleco-stale-bundle-2026-03-24",
  "verifierVersion": "opencompliance-verifier/0.8.0",
  "replayBundleId": "exampleco-stale-bundle-2026-03-24-replay",
  "replayResult": "exact_match",
  "checkedArtifacts": [
    {
      "artifactType": "profile",
      "path": "profile.json",
      "sha256": "6639df224f3c105e4a33b4b12c9c6b5aab5f382576d0c4d5b65676980e256f55"
    },
    {
      "artifactType": "evidence_claims",
      "path": "evidence-claims.json",
      "sha256": "56330472987b8be31795fd326d6019f0308939ad41dc81a0cb320969e21d3f2e"
    },
    {
      "artifactType": "oscal_catalog",
      "path": "oscal/opencompliance-stale-catalog.json",
      "sha256": "9f903f0765ca5396686b55c27d807f396247c22e676341ce82d42eb851ac7e8a"
    },
    {
      "artifactType": "oscal_profile",
      "path": "oscal/exampleco-stale-profile.json",
      "sha256": "0c9bb51fd2facc890dedf6907a483ac9529f5ff94f6f210477e3d586d22172af"
    },
    {
      "artifactType": "proof_bundle",
      "path": "proof-bundle.json",
      "sha256": "dce412b8a060c0aafad0b94ae40b1210ff8d38c6a545112dbaee618ede6fa7b6"
    },
    {
      "artifactType": "trust_surface_report",
      "path": "trust-surface-report.md",
      "sha256": "e1a7773a0182391532df63b1689eaa8ff173923b8e9d455136f5a72715423bbd"
    },
    {
      "artifactType": "verification_result",
      "path": "verification-result.json",
      "sha256": "699b3d8852c948849f8a74d828bc2dba539a84944ff5a8259dec90b28fd5abac"
    },
    {
      "artifactType": "punch_list",
      "path": "punch-list.json",
      "sha256": "13d2c85bf243386059c906cd898ada98dfc364f9db24b64e3f947d30e4149315"
    }
  ],
  "note": "Synthetic public witness receipt for a freshness-blocked ExampleCo corridor rerun."
}
