{
  "receiptId": "exampleco-medium-receipt-2026-03-24",
  "issuedAt": "2026-03-24T01:30:00Z",
  "bundleId": "exampleco-medium-bundle-2026-03-24",
  "verifierVersion": "opencompliance-verifier/0.9.0",
  "replayBundleId": "exampleco-medium-bundle-2026-03-24-replay",
  "replayResult": "exact_match",
  "checkedArtifacts": [
    {
      "artifactType": "profile",
      "path": "profile.json",
      "sha256": "ff4d79cbff91378e6020e81bcdd0ccbc8942c3fd92f3ff7dab5e40ef4737302d"
    },
    {
      "artifactType": "evidence_claims",
      "path": "evidence-claims.json",
      "sha256": "19ca3342684c72fbde299a952eeb1dc2f01f64c06d818e05a11d15ee26bf9b06"
    },
    {
      "artifactType": "oscal_catalog",
      "path": "oscal/opencompliance-medium-catalog.json",
      "sha256": "b708e1223124a14e98c7a0e59302e403769d1d82f21544b8512fbc3ec5382f13"
    },
    {
      "artifactType": "oscal_profile",
      "path": "oscal/exampleco-medium-profile.json",
      "sha256": "608f89ad0490727bca70ea9c6039f22c39e040359c7fb40eedb027229087f2f7"
    },
    {
      "artifactType": "proof_bundle",
      "path": "proof-bundle.json",
      "sha256": "2119186531be4824cca6bc9d1f0bff12a4c2f5eff18a0311c590e7ff347a48da"
    },
    {
      "artifactType": "trust_surface_report",
      "path": "trust-surface-report.md",
      "sha256": "9e801be940e33dd8590a6015834bbc36c1895e246a393a5d8e69cfaf13aa269f"
    },
    {
      "artifactType": "verification_result",
      "path": "verification-result.json",
      "sha256": "1dc002ae8b7f1cb3d587c176c8797ecdfaecba890f33dd6c9a6bebe3e70df51e"
    },
    {
      "artifactType": "punch_list",
      "path": "punch-list.json",
      "sha256": "4637221d652bdf4bb450c1cbab54482c378107e3d445dced16cbfa991659ceb3"
    }
  ],
  "note": "Synthetic public witness receipt for the richer ExampleCo corridor."
}
