{
  "receiptId": "exampleco-cyber-baseline-receipt-2026-03-24",
  "issuedAt": "2026-03-24T06:15:00Z",
  "bundleId": "exampleco-cyber-baseline-bundle-2026-03-24",
  "verifierVersion": "opencompliance-example/0.6.0",
  "replayBundleId": "exampleco-cyber-baseline-bundle-2026-03-24-replay",
  "replayResult": "exact_match",
  "checkedArtifacts": [
    {
      "artifactType": "profile",
      "path": "profile.json",
      "sha256": "d9049584f9bed1bb9ad6da2ef9e9bd755b9e03b3815b203120b1ad2091935e7f"
    },
    {
      "artifactType": "evidence_claims",
      "path": "evidence-claims.json",
      "sha256": "4aef509503fba275ffeee05ba751e5c72880809fcd8211c8e72fda111ef4f5ef"
    },
    {
      "artifactType": "oscal_catalog",
      "path": "oscal/opencompliance-cyber-baseline-catalog.json",
      "sha256": "5a0257d6af86867fafd352d311b83655508b86ac68ef7137d7e588b27e9833d9"
    },
    {
      "artifactType": "oscal_profile",
      "path": "oscal/exampleco-cyber-baseline-profile.json",
      "sha256": "c2a6a573775f058895d385a417fa43b2f6fcd505a95c7ba96601d27c782ae337"
    },
    {
      "artifactType": "proof_bundle",
      "path": "proof-bundle.json",
      "sha256": "568d7f48d6bd879d3e5cc601dcb36ee4c6b61fb7d2921c3cd20cc4c107fd21e1"
    },
    {
      "artifactType": "trust_surface_report",
      "path": "trust-surface-report.md",
      "sha256": "9c4a155895010fd089e14d32dd6757f50e3cef5e66392dbc9d5b89d5865eda14"
    },
    {
      "artifactType": "verification_result",
      "path": "verification-result.json",
      "sha256": "937709dcef58c1822dabc262f40ce91c212ca26fcc631f3a97de167facbc8915"
    },
    {
      "artifactType": "certificate",
      "path": "certificate.json",
      "sha256": "bb646623e69e55b47d4c2bd8af1592b7fb9a09a420d8047ec5e23c95ac4d2540"
    }
  ],
  "note": "Synthetic public witness receipt for an exact-match replay of the cyber baseline ExampleCo corridor."
}
