{
  "receiptId": "exampleco-medium-receipt-2026-03-24",
  "issuedAt": "2026-03-24T01:30:00Z",
  "bundleId": "exampleco-medium-bundle-2026-03-24",
  "verifierVersion": "opencompliance-example/0.2.0",
  "replayBundleId": "exampleco-medium-bundle-2026-03-24-replay",
  "replayResult": "exact_match",
  "checkedArtifacts": [
    {
      "artifactType": "profile",
      "path": "profile.json",
      "sha256": "7b9ed08dc5a1d3319cfd67d02b6fd274a5e1eda58a48b17fee172ef64c102c13"
    },
    {
      "artifactType": "evidence_claims",
      "path": "evidence-claims.json",
      "sha256": "d2cb629e9e014af1e42c0861413562647564e8490964ae4d688c2821fea3cc4a"
    },
    {
      "artifactType": "oscal_catalog",
      "path": "oscal/opencompliance-medium-catalog.json",
      "sha256": "f4b7cbf8a9f8b423850512e71c37c8d3aa49d762fdc046d63ec0b27985eb56b1"
    },
    {
      "artifactType": "oscal_profile",
      "path": "oscal/exampleco-medium-profile.json",
      "sha256": "951669cb1f5a51c3c894fa26770adebe2eae4e11f5d94c9c2200659461545905"
    },
    {
      "artifactType": "proof_bundle",
      "path": "proof-bundle.json",
      "sha256": "7c9adb33158ab05b3f758893289224c2046217cf0c20544092724d3c88acc6eb"
    },
    {
      "artifactType": "trust_surface_report",
      "path": "trust-surface-report.md",
      "sha256": "0e73a18bf0a180ea526699996fc22d452b028d2ad6554569f1a9a9393265b339"
    },
    {
      "artifactType": "verification_result",
      "path": "verification-result.json",
      "sha256": "3c461362b57cc2d9d7db2d678334c5a46905da6bee87395129930fef639082cc"
    },
    {
      "artifactType": "punch_list",
      "path": "punch-list.json",
      "sha256": "f2a5079e5ff98ce88a6ead7c8da0ea404498574542ba9e1d7449f78c199af709"
    }
  ],
  "note": "Synthetic public witness receipt for the richer ExampleCo corridor."
}
