{
  "receiptId": "exampleco-minimal-receipt-2026-03-24",
  "issuedAt": "2026-03-24T00:10:00Z",
  "bundleId": "exampleco-minimal-bundle-2026-03-24",
  "verifierVersion": "opencompliance-verifier/0.9.1",
  "replayBundleId": "exampleco-minimal-bundle-2026-03-24-replay",
  "replayResult": "exact_match",
  "checkedArtifacts": [
    {
      "artifactType": "profile",
      "path": "profile.json",
      "sha256": "63a3124d1b3d1f82f76ccd995c325377c2dacae3754c746e560e302d77f8e89d"
    },
    {
      "artifactType": "evidence_claims",
      "path": "evidence-claims.json",
      "sha256": "23ed2180f290ef2ed6c7ed82eaa6b16ded8e254bb90d4b923149ac8a45aa2e4a"
    },
    {
      "artifactType": "oscal_catalog",
      "path": "oscal/opencompliance-minimal-catalog.json",
      "sha256": "d34320b8e040f15928e314984d16d00b203b18254dcb2d9a7c1a513e176a0bf4"
    },
    {
      "artifactType": "oscal_profile",
      "path": "oscal/exampleco-minimal-profile.json",
      "sha256": "b334905244b4444f7016e406829c1040ec923c73328d082a05600be2e97fb50e"
    },
    {
      "artifactType": "proof_bundle",
      "path": "proof-bundle.json",
      "sha256": "31f8dc92b5291c3f03099ffd6021529933da295a85a035edd84206393992b6b9"
    },
    {
      "artifactType": "trust_surface_report",
      "path": "trust-surface-report.md",
      "sha256": "485c6c6a5b4ee0693f663cc4c688c9bbd6d3848abb1710c2c3046b55ab72332c"
    },
    {
      "artifactType": "verification_result",
      "path": "verification-result.json",
      "sha256": "6bc614e4cd2ccf7e12f639dd477e498a2fd30e2e5251a46911aa0951594dad79"
    },
    {
      "artifactType": "punch_list",
      "path": "punch-list.json",
      "sha256": "32bc125338376e1f0f624d031ebe97b45115ea578b8859175e2ecf31242ea355"
    }
  ],
  "note": "Synthetic public witness receipt for exact-match replay."
}
