{
  "receiptId": "exampleco-issued-receipt-2026-03-24",
  "issuedAt": "2026-03-24T02:15:00Z",
  "bundleId": "exampleco-issued-bundle-2026-03-24",
  "verifierVersion": "opencompliance-verifier/0.8.0",
  "replayBundleId": "exampleco-issued-bundle-2026-03-24-replay",
  "replayResult": "exact_match",
  "checkedArtifacts": [
    {
      "artifactType": "profile",
      "path": "profile.json",
      "sha256": "e5baaad412dd7a1c83956c97b1c0da0e24fefd1569b776ebf098eefbde55ad2f"
    },
    {
      "artifactType": "evidence_claims",
      "path": "evidence-claims.json",
      "sha256": "a775138992f827d025b4ba82e1267cef337f3e0b039331b93430c3a4700cdc8b"
    },
    {
      "artifactType": "oscal_catalog",
      "path": "oscal/opencompliance-issued-catalog.json",
      "sha256": "f6ffdb81567b41a545687cb5bbe884c715cad8d81270f0a54ecda98aeb5713ef"
    },
    {
      "artifactType": "oscal_profile",
      "path": "oscal/exampleco-issued-profile.json",
      "sha256": "1f0fbd754f857ae88d5a16c38f0c20a2d97515810f70ee698dd39c6a6ae60887"
    },
    {
      "artifactType": "proof_bundle",
      "path": "proof-bundle.json",
      "sha256": "0dc1057e7ff2db1bcf97039eb9c4aecc92bdcf229a4a07bfb260553995ea6d4f"
    },
    {
      "artifactType": "trust_surface_report",
      "path": "trust-surface-report.md",
      "sha256": "d23ec5a6abb39727d6f763cb1498fc764a9b81a3e1793a29f876574b2b6ff226"
    },
    {
      "artifactType": "verification_result",
      "path": "verification-result.json",
      "sha256": "32268336a802f1e922a6df3c44246a5dc957deb81d7cf3b35496e58be725e22a"
    },
    {
      "artifactType": "certificate",
      "path": "certificate.json",
      "sha256": "1208f4028c3ac877b2b1d161c93f81e75a233030e54fd83cbb570801be7f7338"
    }
  ],
  "note": "Synthetic public witness receipt for an exact-match replay of the issued ExampleCo corridor."
}
